{
  "schema_version": "1.0",
  "model": "phase2-evidence",
  "domain": "fengshui",
  "classics": [
    {
      "id": "fengshui.classic.zhaifa-phase2",
      "name": "宅法举隅",
      "domain": "fengshui",
      "source_id": "fengshui.source.zhaifa-phase2"
    }
  ],
  "records": [
    {
      "id": "fengshui.evidence.phase2.period-duration",
      "rule_ids": [
        "fengshui.phase2.relative_period"
      ],
      "source_id": "fengshui.source.zhaifa-phase2",
      "classic_id": "fengshui.classic.zhaifa-phase2",
      "chapter_title": "图书二运",
      "locator": "图书二运：洛书三元大运、小运；原文固定commit",
      "original_text": "洛书数九一白属水，二黑属土，三碧属木，四绿属木，五黄属土，六白属金，七属金，八白属土，九紫属火，配列九宫，分按三元起运，每元管六十年，上元六十年，一白统之，为水旺，中元六十年，四绿统之，为木旺，下元六十年，七赤统之，为金旺，所谓三元大运也，各就一元之中分之，则每宫管二十年，上元前二十年，一白司令，中二十年二黑司令，后二十年，三碧司令，中元前二十年，四绿司令，中二十年，五黄司令，后二十年，六白司令，下元前二十年，七赤司令，中二十年，八白司令，后二十年，九紫司令，所谓三元小运也，",
      "review_status": "approved",
      "independence_status": "different_work_unverified_edition",
      "variants": [
        "compass-half-open-explicit-epoch-v1"
      ]
    }
  ]
}
