{
  "schema_version": "1.0",
  "model": "phase2-evidence",
  "domain": "ziwei",
  "records": [
    {
      "id": "ziwei.evidence.phase2.q01",
      "rule_ids": [
        "ziwei.phase2.life_body"
      ],
      "source_id": "ziwei.source.quanshu-phase2",
      "classic_id": "ziwei.classic.quanshu",
      "chapter_title": "安身命例",
      "locator": "bookChapters.json[19].blocks; fixed commit d725dd16b40cb60ec3a027309933deb364054644",
      "original_text": "大抵人命俱從寅上起正月，順數至本生月止，又自人生月起子時逆至本生時安命，順至本生時安身。",
      "review_status": "approved",
      "independence_status": "same_edition_as_phase1",
      "variants": [
        "quanshu-lunar-iztro-mutagen-v1"
      ]
    },
    {
      "id": "ziwei.evidence.phase2.q02",
      "rule_ids": [
        "ziwei.phase2.life_body"
      ],
      "source_id": "ziwei.source.quanshu-phase2",
      "classic_id": "ziwei.classic.quanshu",
      "chapter_title": "安身命例",
      "locator": "bookChapters.json[19].blocks; fixed commit d725dd16b40cb60ec3a027309933deb364054644",
      "original_text": "假如正月生子時就在寅宮安身命，丑時逆轉丑安命，順去卯安身，寅時逆轉子安命，順至辰安身，餘宮仿此，又若閏月正月生者要在二月內起安身命，凡有閏月具要依此為例，納音甲子歌誤要熟讀。",
      "review_status": "approved",
      "independence_status": "same_edition_as_phase1",
      "variants": [
        "quanshu-lunar-iztro-mutagen-v1"
      ]
    },
    {
      "id": "ziwei.evidence.phase2.q03",
      "rule_ids": [
        "ziwei.phase2.life_body"
      ],
      "source_id": "ziwei.source.quanshu-phase2",
      "classic_id": "ziwei.classic.quanshu",
      "chapter_title": "安身命例",
      "locator": "bookChapters.json[19].blocks; fixed commit d725dd16b40cb60ec3a027309933deb364054644",
      "original_text": "如甲生人安命在寅卻起甲己之年丙為首，是丙寅丁卯爐中火，卻去火局尋某日生期起紫微帝王，如是正月初一生者是火局，酉宮起初一日，就從酉宮起紫微，數無差遲，若錯了則失之毫釐，差之千里矣。",
      "review_status": "approved",
      "independence_status": "same_edition_as_phase1",
      "variants": [
        "quanshu-lunar-iztro-mutagen-v1"
      ]
    },
    {
      "id": "ziwei.evidence.phase2.q04",
      "rule_ids": [
        "ziwei.phase2.palaces"
      ],
      "source_id": "ziwei.source.quanshu-phase2",
      "classic_id": "ziwei.classic.quanshu",
      "chapter_title": "安十二宮例",
      "locator": "bookChapters.json[20].blocks; fixed commit d725dd16b40cb60ec3a027309933deb364054644",
      "original_text": "一 命宮、二兄弟、三妻妾、四子女、五財帛、六疾厄、七遷移、八奴僕、九官祿、十田宅、十一福德、十二父母",
      "review_status": "approved",
      "independence_status": "same_edition_as_phase1",
      "variants": [
        "quanshu-lunar-iztro-mutagen-v1"
      ]
    },
    {
      "id": "ziwei.evidence.phase2.q05",
      "rule_ids": [
        "ziwei.phase2.bureau"
      ],
      "source_id": "ziwei.source.quanshu-phase2",
      "classic_id": "ziwei.classic.quanshu",
      "chapter_title": "起五行寅例",
      "locator": "bookChapters.json[21].blocks; fixed commit d725dd16b40cb60ec3a027309933deb364054644",
      "original_text": "甲己之歲起丙寅，乙庚之歲起戊寅，丙辛之歲起庚寅，丁壬之歲起壬寅，戊癸之歲起甲寅。",
      "review_status": "approved",
      "independence_status": "same_edition_as_phase1",
      "variants": [
        "quanshu-lunar-iztro-mutagen-v1"
      ]
    },
    {
      "id": "ziwei.evidence.phase2.q06",
      "rule_ids": [
        "ziwei.phase2.bureau"
      ],
      "source_id": "ziwei.source.quanshu-phase2",
      "classic_id": "ziwei.classic.quanshu",
      "chapter_title": "六十花甲子納音歌",
      "locator": "bookChapters.json[22].blocks; fixed commit d725dd16b40cb60ec3a027309933deb364054644",
      "original_text": "甲子乙丑海中金，丙寅丁卯爐中火，戊辰己巳大林木，庚午辛未路旁土，壬申癸酉劍峰金，",
      "review_status": "approved",
      "independence_status": "same_edition_as_phase1",
      "variants": [
        "quanshu-lunar-iztro-mutagen-v1"
      ]
    },
    {
      "id": "ziwei.evidence.phase2.q07",
      "rule_ids": [
        "ziwei.phase2.bureau"
      ],
      "source_id": "ziwei.source.quanshu-phase2",
      "classic_id": "ziwei.classic.quanshu",
      "chapter_title": "六十花甲子納音歌",
      "locator": "bookChapters.json[22].blocks; fixed commit d725dd16b40cb60ec3a027309933deb364054644",
      "original_text": "甲戊乙亥山頭火，丙子丁丑澗下水，戊寅己卯城頭土，庚辰辛巳白蠟金，壬午癸未楊柳木，",
      "review_status": "approved",
      "independence_status": "same_edition_as_phase1",
      "variants": [
        "quanshu-lunar-iztro-mutagen-v1"
      ]
    },
    {
      "id": "ziwei.evidence.phase2.q08",
      "rule_ids": [
        "ziwei.phase2.bureau"
      ],
      "source_id": "ziwei.source.quanshu-phase2",
      "classic_id": "ziwei.classic.quanshu",
      "chapter_title": "六十花甲子納音歌",
      "locator": "bookChapters.json[22].blocks; fixed commit d725dd16b40cb60ec3a027309933deb364054644",
      "original_text": "甲申乙酉泉中水，丙戌丁亥屋上土，戊子己丑霹靂火，庚寅辛卯松柏木，壬辰癸巳長流水，",
      "review_status": "approved",
      "independence_status": "same_edition_as_phase1",
      "variants": [
        "quanshu-lunar-iztro-mutagen-v1"
      ]
    },
    {
      "id": "ziwei.evidence.phase2.q09",
      "rule_ids": [
        "ziwei.phase2.bureau"
      ],
      "source_id": "ziwei.source.quanshu-phase2",
      "classic_id": "ziwei.classic.quanshu",
      "chapter_title": "六十花甲子納音歌",
      "locator": "bookChapters.json[22].blocks; fixed commit d725dd16b40cb60ec3a027309933deb364054644",
      "original_text": "甲午乙未沙中金，丙申丁酉山下火，戊戌已亥平地木，庚子辛丑壁上土，壬寅癸卯金箔金，",
      "review_status": "approved",
      "independence_status": "same_edition_as_phase1",
      "variants": [
        "quanshu-lunar-iztro-mutagen-v1"
      ]
    },
    {
      "id": "ziwei.evidence.phase2.q10",
      "rule_ids": [
        "ziwei.phase2.bureau"
      ],
      "source_id": "ziwei.source.quanshu-phase2",
      "classic_id": "ziwei.classic.quanshu",
      "chapter_title": "六十花甲子納音歌",
      "locator": "bookChapters.json[22].blocks; fixed commit d725dd16b40cb60ec3a027309933deb364054644",
      "original_text": "甲辰乙巳覆燈火，丙午丁未天河水，戊申己酉大驛土，庚戌辛亥釵釧金，壬子癸丑桑拓木，",
      "review_status": "approved",
      "independence_status": "same_edition_as_phase1",
      "variants": [
        "quanshu-lunar-iztro-mutagen-v1"
      ]
    },
    {
      "id": "ziwei.evidence.phase2.q11",
      "rule_ids": [
        "ziwei.phase2.bureau"
      ],
      "source_id": "ziwei.source.quanshu-phase2",
      "classic_id": "ziwei.classic.quanshu",
      "chapter_title": "六十花甲子納音歌",
      "locator": "bookChapters.json[22].blocks; fixed commit d725dd16b40cb60ec3a027309933deb364054644",
      "original_text": "甲寅乙卯大溪水，丙辰丁巳沙中土，戊午己未天上火，庚申辛酉石榴木，壬戌癸亥大海水。",
      "review_status": "approved",
      "independence_status": "same_edition_as_phase1",
      "variants": [
        "quanshu-lunar-iztro-mutagen-v1"
      ]
    },
    {
      "id": "ziwei.evidence.phase2.q12",
      "rule_ids": [
        "ziwei.phase2.major_stars"
      ],
      "source_id": "ziwei.source.quanshu-phase2",
      "classic_id": "ziwei.classic.quanshu",
      "chapter_title": "安南北斗諸星訣",
      "locator": "bookChapters.json[23].blocks; fixed commit d725dd16b40cb60ec3a027309933deb364054644",
      "original_text": "紫微天機逆行旁，隔一陽武天同當，又隔二位廉貞地，空三復見紫微郎，",
      "review_status": "approved",
      "independence_status": "same_edition_as_phase1",
      "variants": [
        "quanshu-lunar-iztro-mutagen-v1"
      ]
    },
    {
      "id": "ziwei.evidence.phase2.q13",
      "rule_ids": [
        "ziwei.phase2.major_stars"
      ],
      "source_id": "ziwei.source.quanshu-phase2",
      "classic_id": "ziwei.classic.quanshu",
      "chapter_title": "安南北斗諸星訣",
      "locator": "bookChapters.json[23].blocks; fixed commit d725dd16b40cb60ec3a027309933deb364054644",
      "original_text": "天府太陰與貪狼，巨門天相及天梁，七殺空三破軍位，八星順數細推詳。",
      "review_status": "approved",
      "independence_status": "same_edition_as_phase1",
      "variants": [
        "quanshu-lunar-iztro-mutagen-v1"
      ]
    },
    {
      "id": "ziwei.evidence.phase2.q14",
      "rule_ids": [
        "ziwei.phase2.major_stars"
      ],
      "source_id": "ziwei.source.quanshu-phase2",
      "classic_id": "ziwei.classic.quanshu",
      "chapter_title": "安紫微天府圖",
      "locator": "bookChapters.json[61].blocks; fixed commit d725dd16b40cb60ec3a027309933deb364054644",
      "original_text": "天府惟寅申二宮紫府同宮，餘\n宮俱各填協作對如紫居丑則府\n居卯矣。",
      "review_status": "approved",
      "independence_status": "same_edition_as_phase1",
      "variants": [
        "quanshu-lunar-iztro-mutagen-v1"
      ]
    }
  ]
}
